{
  "schema_version": "intent_set.v1",
  "agent_id": "recouvrement",
  "set_version": "2026-08-23.1",
  "description": "Labeled layer-1 understanding referent for the Recouvrement operator agent (ADR 0053 §7). 5 intents × 3 languages × 8 cases. Labels are what a human reader understands the operator to be asking — deliberately independent of any classifier's answer. Each cell mixes canonical phrasings (word lists should catch them) and paraphrases without magic words (the cases that justify an LLM, labeled truthfully either way). Fields are labeled only where the utterance states them and never where the value would be clock-dependent (\"maintenant\"/\"now\"/\"jetzt\").",
  "cases": [
    {
      "id": "fr_schedule_01",
      "language": "fr",
      "utterance": "Propose un échéancier sur 6 mois pour ce dossier",
      "expected_intent": "propose_schedule",
      "expected_fields": { "duration_months": 6 },
      "provenance": "hand_authored"
    },
    {
      "id": "fr_schedule_02",
      "language": "fr",
      "utterance": "Peut-on étaler la dette en 4 mensualités ?",
      "expected_intent": "propose_schedule",
      "expected_fields": { "duration_months": 4 },
      "provenance": "hand_authored"
    },
    {
      "id": "fr_schedule_03",
      "language": "fr",
      "utterance": "Prépare un étalement du paiement sur douze mois",
      "expected_intent": "propose_schedule",
      "expected_fields": { "duration_months": 12 },
      "provenance": "hand_authored",
      "note": "Duration spelled out in words — a digit-only parser misses it; the truth is still 12."
    },
    {
      "id": "fr_schedule_04",
      "language": "fr",
      "utterance": "Le client demande à régler en plusieurs fois, monte un plan",
      "expected_intent": "propose_schedule",
      "provenance": "hand_authored"
    },
    {
      "id": "fr_schedule_05",
      "language": "fr",
      "utterance": "Découpe le montant dû en trois versements égaux",
      "expected_intent": "propose_schedule",
      "expected_fields": { "duration_months": 3 },
      "provenance": "hand_authored",
      "note": "No magic word from any list; 'versements' is common collections vocabulary."
    },
    {
      "id": "fr_schedule_06",
      "language": "fr",
      "utterance": "Il faudrait lisser le remboursement sur 9 mois",
      "expected_intent": "propose_schedule",
      "expected_fields": { "duration_months": 9 },
      "provenance": "hand_authored"
    },
    {
      "id": "fr_schedule_07",
      "language": "fr",
      "utterance": "Mets en place un plan de remboursement indicatif",
      "expected_intent": "propose_schedule",
      "provenance": "hand_authored",
      "note": "'remboursement' is not on the FR schedule list (only EN 'repayment' is)."
    },
    {
      "id": "fr_schedule_08",
      "language": "fr",
      "utterance": "Un échéancier de 5 mensualités, c'est faisable ?",
      "expected_intent": "propose_schedule",
      "expected_fields": { "duration_months": 5 },
      "provenance": "hand_authored"
    },
    {
      "id": "fr_draft_01",
      "language": "fr",
      "utterance": "Rédige une relance amiable pour ce client",
      "expected_intent": "draft_reminder",
      "provenance": "hand_authored"
    },
    {
      "id": "fr_draft_02",
      "language": "fr",
      "utterance": "Prépare un brouillon d'email de rappel",
      "expected_intent": "draft_reminder",
      "provenance": "hand_authored"
    },
    {
      "id": "fr_draft_03",
      "language": "fr",
      "utterance": "Écris un message client pour l'informer du retard",
      "expected_intent": "draft_reminder",
      "provenance": "hand_authored"
    },
    {
      "id": "fr_draft_04",
      "language": "fr",
      "utterance": "Rends-le plus empathique",
      "expected_intent": "draft_reminder",
      "provenance": "hand_authored",
      "note": "Edit of the current draft — the drawer's own rewrite phrasing."
    },
    {
      "id": "fr_draft_05",
      "language": "fr",
      "utterance": "Fais une version courte du courrier",
      "expected_intent": "draft_reminder",
      "provenance": "hand_authored"
    },
    {
      "id": "fr_draft_06",
      "language": "fr",
      "utterance": "Il faut écrire au client au sujet de son impayé, prépare quelque chose",
      "expected_intent": "draft_reminder",
      "provenance": "hand_authored",
      "note": "The object is a written message; 'écrire' is not on the drafting-verb list."
    },
    {
      "id": "fr_draft_07",
      "language": "fr",
      "utterance": "Adoucis le ton de la dernière proposition de message",
      "expected_intent": "draft_reminder",
      "provenance": "hand_authored"
    },
    {
      "id": "fr_draft_08",
      "language": "fr",
      "utterance": "Prépare une lettre de rappel courtoise",
      "expected_intent": "draft_reminder",
      "provenance": "hand_authored",
      "note": "'lettre' is not on the list ('courrier' is)."
    },
    {
      "id": "fr_summary_01",
      "language": "fr",
      "utterance": "Résume ce dossier",
      "expected_intent": "summarize_case",
      "provenance": "hand_authored"
    },
    {
      "id": "fr_summary_02",
      "language": "fr",
      "utterance": "Fais une synthèse de la situation du client",
      "expected_intent": "summarize_case",
      "provenance": "hand_authored"
    },
    {
      "id": "fr_summary_03",
      "language": "fr",
      "utterance": "Quels sont les points clés à retenir ?",
      "expected_intent": "summarize_case",
      "provenance": "hand_authored"
    },
    {
      "id": "fr_summary_04",
      "language": "fr",
      "utterance": "Résume ce dossier pour préparer l'action suivante",
      "expected_intent": "summarize_case",
      "provenance": "production_incident",
      "note": "Reproduced misroute on the deployed host, 2026-08-02: the bare verb 'préparer' matched the draft list and a summary request was answered with a reminder draft. Fixed by removing bare verbs (see _has_draft_intent docstring)."
    },
    {
      "id": "fr_summary_05",
      "language": "fr",
      "utterance": "Où en est-on sur ce dossier ?",
      "expected_intent": "summarize_case",
      "provenance": "hand_authored"
    },
    {
      "id": "fr_summary_06",
      "language": "fr",
      "utterance": "Donne-moi l'essentiel avant mon appel",
      "expected_intent": "summarize_case",
      "provenance": "hand_authored",
      "note": "'appel' names the operator's next step, not a contact-rule question."
    },
    {
      "id": "fr_summary_07",
      "language": "fr",
      "utterance": "Qu'est-ce que je dois savoir sur la situation de ce client ?",
      "expected_intent": "summarize_case",
      "provenance": "hand_authored"
    },
    {
      "id": "fr_summary_08",
      "language": "fr",
      "utterance": "Brief-moi sur le dossier RC-2048",
      "expected_intent": "summarize_case",
      "provenance": "hand_authored"
    },
    {
      "id": "fr_contact_01",
      "language": "fr",
      "utterance": "Puis-je appeler le client à 21h ?",
      "expected_intent": "check_contact_rule",
      "expected_fields": { "requested_time": "21:00" },
      "provenance": "hand_authored"
    },
    {
      "id": "fr_contact_02",
      "language": "fr",
      "utterance": "Est-ce que je peux le joindre maintenant ?",
      "expected_intent": "check_contact_rule",
      "provenance": "hand_authored",
      "note": "No time label on purpose: 'maintenant' resolves against the clock."
    },
    {
      "id": "fr_contact_03",
      "language": "fr",
      "utterance": "Quelle est la plage d'appel autorisée aujourd'hui ?",
      "expected_intent": "check_contact_rule",
      "provenance": "hand_authored"
    },
    {
      "id": "fr_contact_04",
      "language": "fr",
      "utterance": "Rappelle-moi la règle de contact pour ce dossier",
      "expected_intent": "check_contact_rule",
      "provenance": "hand_authored"
    },
    {
      "id": "fr_contact_05",
      "language": "fr",
      "utterance": "Un appel à 7h30, c'est conforme ?",
      "expected_intent": "check_contact_rule",
      "expected_fields": { "requested_time": "07:30" },
      "provenance": "hand_authored"
    },
    {
      "id": "fr_contact_06",
      "language": "fr",
      "utterance": "Ai-je le droit de téléphoner au client ce soir à 19h ?",
      "expected_intent": "check_contact_rule",
      "expected_fields": { "requested_time": "19:00" },
      "provenance": "hand_authored"
    },
    {
      "id": "fr_contact_07",
      "language": "fr",
      "utterance": "Le cadre autorise-t-il un contact en soirée ?",
      "expected_intent": "check_contact_rule",
      "provenance": "hand_authored"
    },
    {
      "id": "fr_contact_08",
      "language": "fr",
      "utterance": "On peut le déranger là, tout de suite ?",
      "expected_intent": "check_contact_rule",
      "provenance": "hand_authored",
      "note": "Colloquial; no word from any list."
    },
    {
      "id": "fr_payment_01",
      "language": "fr",
      "utterance": "Quelles sont les options de paiement pour ce dossier ?",
      "expected_intent": "explain_payment_options",
      "provenance": "hand_authored"
    },
    {
      "id": "fr_payment_02",
      "language": "fr",
      "utterance": "Comment le client peut-il régler sa dette ?",
      "expected_intent": "explain_payment_options",
      "provenance": "hand_authored",
      "note": "'régler' also sits on the schedule list — a word two lists claim."
    },
    {
      "id": "fr_payment_03",
      "language": "fr",
      "utterance": "Liste les moyens de règlement possibles",
      "expected_intent": "explain_payment_options",
      "provenance": "hand_authored"
    },
    {
      "id": "fr_payment_04",
      "language": "fr",
      "utterance": "Paiement total ou partiel, qu'est-ce qu'on peut lui proposer ?",
      "expected_intent": "explain_payment_options",
      "provenance": "hand_authored"
    },
    {
      "id": "fr_payment_05",